{
  "$schema": "https://json-schema.org/draft/2020-12/schema",
  "$id": "wattson/activity-vector/v1",
  "title": "wattson activity vector",
  "description": "DERIVED functional-activity counts from a QEMU run. NOT measured silicon power, NOT watts. The activity (alpha) half of P = sum(energy_per_event * event_count); the energy half is supplied by the power team's model.",
  "type": "object",
  "required": ["schema", "workload", "provenance", "activity"],
  "properties": {
    "schema": { "const": "wattson/activity-vector/v1" },
    "workload": { "type": "string", "description": "workload label" },
    "provenance": {
      "type": "string",
      "description": "must state DERIVED-from-QEMU; never 'measured silicon'"
    },
    "note": { "type": "string" },
    "timing": {
      "type": "object",
      "description": "THE TIME BASE. The counts in `activity` are TOTALS; power is a RATE, and a total cannot be converted to a rate without a duration. Omitting this made the vector unable to predict power at all - only energy over a whole run. wall_ns is HOST wall time for the QEMU run, which is NOT guest time and NOT silicon time: it is the denominator for a host-side rate and a sanity check on run-to-run variance, nothing more. Use it to normalise two runs to equal duration; do NOT present anything derived from it as a silicon rate.",
      "required": ["wall_ns", "wall_ns_provenance"],
      "properties": {
        "wall_ns": {
          "type": "integer",
          "description": "host wall-clock nanoseconds for the QEMU run, measured by the harness"
        },
        "wall_ns_provenance": {
          "type": "string",
          "description": "must say the clock is HOST wall time under TCG, not guest or silicon time"
        },
        "guest_insn_rate_est": {
          "type": ["number", "null"],
          "description": "total_insns / (wall_ns/1e9). A HOST throughput figure for the emulation, NOT the silicon's instruction rate - TCG is not cycle-accurate. Present only as an emulation-speed diagnostic."
        }
      }
    },
    "activity": {
      "type": "object",
      "required": ["cores"],
      "properties": {
        "cores": {
          "type": "object",
          "properties": {
            "count_seen": { "type": "integer" },
            "count_active": { "type": "integer" },
            "insns_by_cpu": {
              "type": "object",
              "description": "cpu index -> instructions retired (active cores only)",
              "additionalProperties": { "type": "integer" }
            },
            "total_insns": { "type": ["integer", "null"] },
            "active_fraction_by_cpu": {
              "type": "object",
              "description": "P1: cpu index -> active/(active+halted) duty cycle in [0,1]",
              "additionalProperties": { "type": "number" }
            }
          }
        },
        "memory": {
          "type": "object",
          "description": "from the functional cache plugin; misses are the DRAM-transaction proxy",
          "properties": {
            "data_accesses": { "type": "integer" },
            "data_misses": { "type": "integer" },
            "dmiss_rate": { "type": "number" },
            "insn_accesses": { "type": "integer" },
            "insn_misses": { "type": "integer" },
            "imiss_rate": { "type": "number" },
            "dram_transactions_est": { "type": "integer" },
            "dram_bytes_est": { "type": "integer" },
            "line_bytes": { "type": "integer" }
          }
        },
        "accelerators": {
          "type": "object",
          "description": "P1+: modeled-block name -> active-cycle fraction in [0,1] (duty cycle; compute is faked but invocation timing is real)",
          "additionalProperties": {
            "type": "object",
            "properties": {
              "active_fraction": { "type": "number" },
              "jobs": { "type": "integer" }
            }
          }
        }
      }
    }
  }
}
